A1: PGS 341 Scores (Summer 2004)
B2: Exam 1 | F2: Exam 2 | J2: Exam 3 | N2: Exam 4 | R2: Exam 5 | V2: Exam 6 | Z2: Final Scores
A3: 4 digits | B3: MC1 | D3: E1 | E3: % | F3: MC2 | H3: E2 | I3: % | J3: MC3 | L3: E3 | M3: % | N3: MC4 | P3: E4 | Q3: % | R3: MC5 | T3: E5 | U3: % | V3: MC6 | X3: E6 | Y3: % | Z3: Pts | AA3: Final % | AB3: Grade
A4: 0573 | B4: 28 | C4: =B4*3 -> 84 | D4: 75 | E4: =(SUM(C4:D4)/170)*100 -> 93.529411764705884 | F4: 28 | G4: =F4*3 -> 84 | H4: 80 | I4: =(SUM(G4:H4)/170)*100 -> 96.470588235294116 | J4: 27 | K4: =J4*3 -> 81 | L4: 75 | M4: =(SUM(K4:L4)/170)*100 -> 91.764705882352942 | N4: 26 | O4: =N4*3 -> 78 | P4: 80 | Q4: =(SUM(O4:P4)/170)*100 -> 92.941176470588232 | R4: 25 | S4: =R4*3 -> 75 | T4: 80 | U4: =(SUM(S4:T4)/170)*100 -> 91.17647058823529 | V4: 25 | W4: =V4*3 -> 75 | X4: 75 | Y4: =(SUM(W4:X4)/170)*100 -> 88.235294117647058 | Z4: =C4+D4+G4+H4+K4+L4+O4+P4+S4+T4+W4+X4 -> 942 | AA4: =(C4+D4+G4+H4+K4+L4+O4+P4+S4+T4+W4+X4)/1020*100 -> 92.352941176470594 | AB4: A
A5: 0883 | B5: 27 | C5: =B5*3 -> 81 | D5: 65 | E5: =(SUM(C5:D5)/170)*100 -> 85.882352941176464 | F5: 24 | G5: =F5*3 -> 72 | H5: 75 | I5: =(SUM(G5:H5)/170)*100 -> 86.470588235294116 | J5: 27 | K5: =J5*3 -> 81 | L5: 75 | M5: =(SUM(K5:L5)/170)*100 -> 91.764705882352942 | N5: 25 | O5: =N5*3 -> 75 | P5: 75 | Q5: =(SUM(O5:P5)/170)*100 -> 88.235294117647058 | R5: 27 | S5: =R5*3 -> 81 | T5: 80 | U5: =(SUM(S5:T5)/170)*100 -> 94.705882352941174 | V5: 29 | W5: =V5*3 -> 87 | X5: 80 | Y5: =(SUM(W5:X5)/170)*100 -> 98.235294117647058 | Z5: =C5+D5+G5+H5+K5+L5+O5+P5+S5+T5+W5+X5 -> 927 | AA5: =(C5+D5+G5+H5+K5+L5+O5+P5+S5+T5+W5+X5)/1020*100 -> 90.882352941176464 | AB5: A
A6: 1068 | B6: 20 | C6: =B6*3 -> 60 | D6: 70 | E6: =(SUM(C6:D6)/170)*100 -> 76.470588235294116 | F6: 25 | G6: =F6*3 -> 75 | H6: 70 | I6: =(SUM(G6:H6)/170)*100 -> 85.294117647058826 | J6: 24 | K6: =J6*3 -> 72 | L6: 75 | M6: =(SUM(K6:L6)/170)*100 -> 86.470588235294116 | N6: 21 | O6: =N6*3 -> 63 | P6: 75 | Q6: =(SUM(O6:P6)/170)*100 -> 81.17647058823529 | R6: 27 | S6: =R6*3 -> 81 | T6: 80 | U6: =(SUM(S6:T6)/170)*100 -> 94.705882352941174 | V6: 25 | W6: =V6*3 -> 75 | X6: 80 | Y6: =(SUM(W6:X6)/170)*100 -> 91.17647058823529 | Z6: =C6+D6+G6+H6+K6+L6+O6+P6+S6+T6+W6+X6 -> 876 | AA6: =(C6+D6+G6+H6+K6+L6+O6+P6+S6+T6+W6+X6)/1020*100 -> 85.882352941176464 | AB6: B
A7: 1133 | B7: 28 | C7: =B7*3 -> 84 | D7: 80 | E7: =(SUM(C7:D7)/170)*100 -> 96.470588235294116 | F7: 28 | G7: =F7*3 -> 84 | H7: 80 | I7: =(SUM(G7:H7)/170)*100 -> 96.470588235294116 | J7: 27 | K7: =J7*3 -> 81 | L7: 75 | M7: =(SUM(K7:L7)/170)*100 -> 91.764705882352942 | N7: 27 | O7: =N7*3 -> 81 | P7: 80 | Q7: =(SUM(O7:P7)/170)*100 -> 94.705882352941174 | R7: 28 | S7: =R7*3 -> 84 | T7: 80 | U7: =(SUM(S7:T7)/170)*100 -> 96.470588235294116 | V7: 26 | W7: =V7*3 -> 78 | X7: 80 | Y7: =(SUM(W7:X7)/170)*100 -> 92.941176470588232 | Z7: =C7+D7+G7+H7+K7+L7+O7+P7+S7+T7+W7+X7 -> 967 | AA7: =(C7+D7+G7+H7+K7+L7+O7+P7+S7+T7+W7+X7)/1020*100 -> 94.803921568627445 | AB7: A
A8: 1322 | B8: 24 | C8: =B8*3 -> 72 | D8: 75 | E8: =(SUM(C8:D8)/170)*100 -> 86.470588235294116 | F8: 18 | G8: =F8*3 -> 54 | H8: 75 | I8: =(SUM(G8:H8)/170)*100 -> 75.882352941176464 | J8: 20 | K8: =J8*3 -> 60 | L8: 75 | M8: =(SUM(K8:L8)/170)*100 -> 79.411764705882348 | N8: 14 | O8: =N8*3 -> 42 | P8: 65 | Q8: =(SUM(O8:P8)/170)*100 -> 62.941176470588232 | R8: 23 | S8: =R8*3 -> 69 | T8: 70 | U8: =(SUM(S8:T8)/170)*100 -> 81.764705882352942 | V8: 19 | W8: =V8*3 -> 57 | X8: 70 | Y8: =(SUM(W8:X8)/170)*100 -> 74.705882352941174 | Z8: =C8+D8+G8+H8+K8+L8+O8+P8+S8+T8+W8+X8 -> 784 | AA8: =(C8+D8+G8+H8+K8+L8+O8+P8+S8+T8+W8+X8)/1020*100 -> 76.862745098039227 | AB8: C
A9: 1401 | B9: 25 | C9: =B9*3 -> 75 | D9: 70 | E9: =(SUM(C9:D9)/170)*100 -> 85.294117647058826 | F9: 27 | G9: =F9*3 -> 81 | H9: 70 | I9: =(SUM(G9:H9)/170)*100 -> 88.823529411764696 | J9: 24 | K9: =J9*3 -> 72 | L9: 75 | M9: =(SUM(K9:L9)/170)*100 -> 86.470588235294116 | N9: 21 | O9: =N9*3 -> 63 | P9: 78 | Q9: =(SUM(O9:P9)/170)*100 -> 82.941176470588246 | R9: 19 | S9: =R9*3 -> 57 | T9: 80 | U9: =(SUM(S9:T9)/170)*100 -> 80.588235294117652 | V9: 24 | W9: =V9*3 -> 72 | X9: 80 | Y9: =(SUM(W9:X9)/170)*100 -> 89.411764705882362 | Z9: =C9+D9+G9+H9+K9+L9+O9+P9+S9+T9+W9+X9 -> 873 | AA9: =(C9+D9+G9+H9+K9+L9+O9+P9+S9+T9+W9+X9)/1020*100 -> 85.588235294117638 | AB9: B
A10: 1774 | B10: 27 | C10: =B10*3 -> 81 | D10: 80 | E10: =(SUM(C10:D10)/170)*100 -> 94.705882352941174 | F10: 28 | G10: =F10*3 -> 84 | H10: 75 | I10: =(SUM(G10:H10)/170)*100 -> 93.529411764705884 | J10: 22 | K10: =J10*3 -> 66 | L10: 75 | M10: =(SUM(K10:L10)/170)*100 -> 82.941176470588246 | N10: 27 | O10: =N10*3 -> 81 | P10: 75 | Q10: =(SUM(O10:P10)/170)*100 -> 91.764705882352942 | R10: 27 | S10: =R10*3 -> 81 | T10: 80 | U10: =(SUM(S10:T10)/170)*100 -> 94.705882352941174 | V10: 24 | W10: =V10*3 -> 72 | X10: 78 | Y10: =(SUM(W10:X10)/170)*100 -> 88.235294117647058 | Z10: =C10+D10+G10+H10+K10+L10+O10+P10+S10+T10+W10+X10 -> 928 | AA10: =(C10+D10+G10+H10+K10+L10+O10+P10+S10+T10+W10+X10)/1020*100 -> 90.980392156862749 | AB10: A
A11: 2970 | B11: 25 | C11: =B11*3 -> 75 | D11: 80 | E11: =(SUM(C11:D11)/170)*100 -> 91.17647058823529 | F11: 22 | G11: =F11*3 -> 66 | H11: 70 | I11: =(SUM(G11:H11)/170)*100 -> 80 | J11: 27 | K11: =J11*3 -> 81 | L11: 75 | M11: =(SUM(K11:L11)/170)*100 -> 91.764705882352942 | N11: 21 | O11: =N11*3 -> 63 | P11: 80 | Q11: =(SUM(O11:P11)/170)*100 -> 84.117647058823536 | R11: 23 | S11: =R11*3 -> 69 | T11: 80 | U11: =(SUM(S11:T11)/170)*100 -> 87.647058823529406 | V11: 26 | W11: =V11*3 -> 78 | X11: 80 | Y11: =(SUM(W11:X11)/170)*100 -> 92.941176470588232 | Z11: =C11+D11+G11+H11+K11+L11+O11+P11+S11+T11+W11+X11 -> 897 | AA11: =(C11+D11+G11+H11+K11+L11+O11+P11+S11+T11+W11+X11)/1020*100 -> 87.941176470588232 | AB11: B
A12: 3544 | B12: 29 | C12: =B12*3 -> 87 | D12: 75 | E12: =(SUM(C12:D12)/170)*100 -> 95.294117647058812 | F12: 29 | G12: =F12*3 -> 87 | H12: 80 | I12: =(SUM(G12:H12)/170)*100 -> 98.235294117647058 | J12: 24 | K12: =J12*3 -> 72 | L12: 73 | M12: =(SUM(K12:L12)/170)*100 -> 85.294117647058826 | N12: 28 | O12: =N12*3 -> 84 | P12: 80 | Q12: =(SUM(O12:P12)/170)*100 -> 96.470588235294116 | R12: 29 | S12: =R12*3 -> 87 | T12: 80 | U12: =(SUM(S12:T12)/170)*100 -> 98.235294117647058 | V12: 27 | W12: =V12*3 -> 81 | X12: 80 | Y12: =(SUM(W12:X12)/170)*100 -> 94.705882352941174 | Z12: =C12+D12+G12+H12+K12+L12+O12+P12+S12+T12+W12+X12 -> 966 | AA12: =(C12+D12+G12+H12+K12+L12+O12+P12+S12+T12+W12+X12)/1020*100 -> 94.705882352941174 | AB12: A
A13: 5033 | B13: 23 | C13: =B13*3 -> 69 | D13: 75 | E13: =(SUM(C13:D13)/170)*100 -> 84.705882352941174 | F13: 19 | G13: =F13*3 -> 57 | H13: 80 | I13: =(SUM(G13:H13)/170)*100 -> 80.588235294117652 | J13: 24 | K13: =J13*3 -> 72 | L13: 75 | M13: =(SUM(K13:L13)/170)*100 -> 86.470588235294116 | N13: 19 | O13: =N13*3 -> 57 | P13: 80 | Q13: =(SUM(O13:P13)/170)*100 -> 80.588235294117652 | R13: 22 | S13: =R13*3 -> 66 | T13: 80 | U13: =(SUM(S13:T13)/170)*100 -> 85.882352941176464 | V13: 25 | W13: =V13*3 -> 75 | X13: 78 | Y13: =(SUM(W13:X13)/170)*100 -> 90 | Z13: =C13+D13+G13+H13+K13+L13+O13+P13+S13+T13+W13+X13 -> 864 | AA13: =(C13+D13+G13+H13+K13+L13+O13+P13+S13+T13+W13+X13)/1020*100 -> 84.705882352941174 | AB13: B
A14: 5089 | B14: 23 | C14: =B14*3 -> 69 | D14: 65 | E14: =(SUM(C14:D14)/170)*100 -> 78.82352941176471 | F14: 24 | G14: =F14*3 -> 72 | H14: 75 | I14: =(SUM(G14:H14)/170)*100 -> 86.470588235294116 | J14: 20 | K14: =J14*3 -> 60 | L14: 73 | M14: =(SUM(K14:L14)/170)*100 -> 78.235294117647058 | N14: 13 | O14: =N14*3 -> 39 | P14: 65 | Q14: =(SUM(O14:P14)/170)*100 -> 61.176470588235297 | R14: 24 | S14: =R14*3 -> 72 | T14: 75 | U14: =(SUM(S14:T14)/170)*100 -> 86.470588235294116 | V14: 26 | W14: =V14*3 -> 78 | X14: 75 | Y14: =(SUM(W14:X14)/170)*100 -> 90 | Z14: =C14+D14+G14+H14+K14+L14+O14+P14+S14+T14+W14+X14 -> 818 | AA14: =(C14+D14+G14+H14+K14+L14+O14+P14+S14+T14+W14+X14)/1020*100 -> 80.196078431372555 | AB14: B
A15: 5467 | B15: 27 | C15: =B15*3 -> 81 | D15: 75 | E15: =(SUM(C15:D15)/170)*100 -> 91.764705882352942 | F15: 26 | G15: =F15*3 -> 78 | H15: 75 | I15: =(SUM(G15:H15)/170)*100 -> 90 | J15: 27 | K15: =J15*3 -> 81 | L15: 75 | M15: =(SUM(K15:L15)/170)*100 -> 91.764705882352942 | N15: 26 | O15: =N15*3 -> 78 | P15: 80 | Q15: =(SUM(O15:P15)/170)*100 -> 92.941176470588232 | R15: 25 | S15: =R15*3 -> 75 | T15: 80 | U15: =(SUM(S15:T15)/170)*100 -> 91.17647058823529 | V15: 27 | W15: =V15*3 -> 81 | X15: 75 | Y15: =(SUM(W15:X15)/170)*100 -> 91.764705882352942 | Z15: =C15+D15+G15+H15+K15+L15+O15+P15+S15+T15+W15+X15 -> 934 | AA15: =(C15+D15+G15+H15+K15+L15+O15+P15+S15+T15+W15+X15)/1020*100 -> 91.568627450980387 | AB15: A
A16: 5707 | B16: 26 | C16: =B16*3 -> 78 | D16: 70 | E16: =(SUM(C16:D16)/170)*100 -> 87.058823529411768 | F16: 26 | G16: =F16*3 -> 78 | H16: 70 | I16: =(SUM(G16:H16)/170)*100 -> 87.058823529411768 | J16: 24 | K16: =J16*3 -> 72 | L16: 70 | M16: =(SUM(K16:L16)/170)*100 -> 83.529411764705884 | N16: 22 | O16: =N16*3 -> 66 | P16: 60 | Q16: =(SUM(O16:P16)/170)*100 -> 74.117647058823536 | R16: 23 | S16: =R16*3 -> 69 | T16: 78 | U16: =(SUM(S16:T16)/170)*100 -> 86.470588235294116 | V16: 26 | W16: =V16*3 -> 78 | X16: 80 | Y16: =(SUM(W16:X16)/170)*100 -> 92.941176470588232 | Z16: =C16+D16+G16+H16+K16+L16+O16+P16+S16+T16+W16+X16 -> 869 | AA16: =(C16+D16+G16+H16+K16+L16+O16+P16+S16+T16+W16+X16)/1020*100 -> 85.196078431372541 | AB16: B
A17: 6397 | B17: 24 | C17: =B17*3 -> 72 | D17: 80 | E17: =(SUM(C17:D17)/170)*100 -> 89.411764705882362 | F17: 28 | G17: =F17*3 -> 84 | H17: 75 | I17: =(SUM(G17:H17)/170)*100 -> 93.529411764705884 | J17: 28 | K17: =J17*3 -> 84 | L17: 75 | M17: =(SUM(K17:L17)/170)*100 -> 93.529411764705884 | N17: 25 | O17: =N17*3 -> 75 | P17: 80 | Q17: =(SUM(O17:P17)/170)*100 -> 91.17647058823529 | R17: 24 | S17: =R17*3 -> 72 | T17: 80 | U17: =(SUM(S17:T17)/170)*100 -> 89.411764705882362 | V17: 28 | W17: =V17*3 -> 84 | X17: 80 | Y17: =(SUM(W17:X17)/170)*100 -> 96.470588235294116 | Z17: =C17+D17+G17+H17+K17+L17+O17+P17+S17+T17+W17+X17 -> 941 | AA17: =(C17+D17+G17+H17+K17+L17+O17+P17+S17+T17+W17+X17)/1020*100 -> 92.254901960784323 | AB17: A
A18: 6938 | B18: 26 | C18: =B18*3 -> 78 | D18: 60 | E18: =(SUM(C18:D18)/170)*100 -> 81.17647058823529 | F18: 15 | G18: =F18*3 -> 45 | H18: 0 | I18: =(SUM(G18:H18)/170)*100 -> 26.47058823529412 | J18: 23 | K18: =J18*3 -> 69 | L18: 75 | M18: =(SUM(K18:L18)/170)*100 -> 84.705882352941174 | N18: 22 | O18: =N18*3 -> 66 | P18: 70 | Q18: =(SUM(O18:P18)/170)*100 -> 80 | R18: 25 | S18: =R18*3 -> 75 | T18: 75 | U18: =(SUM(S18:T18)/170)*100 -> 88.235294117647058 | V18: 21 | W18: =V18*3 -> 63 | X18: 73 | Y18: =(SUM(W18:X18)/170)*100 -> 80 | Z18: =C18+D18+G18+H18+K18+L18+O18+P18+S18+T18+W18+X18 -> 749 | AA18: =(C18+D18+G18+H18+K18+L18+O18+P18+S18+T18+W18+X18)/1020*100 -> 73.431372549019599 | AB18: C
A19: 7691 | B19: 22 | C19: =B19*3 -> 66 | D19: 70 | E19: =(SUM(C19:D19)/170)*100 -> 80 | F19: 22 | G19: =F19*3 -> 66 | H19: 80 | I19: =(SUM(G19:H19)/170)*100 -> 85.882352941176464 | J19: 25 | K19: =J19*3 -> 75 | L19: 78 | M19: =(SUM(K19:L19)/170)*100 -> 90 | N19: 24 | O19: =N19*3 -> 72 | P19: 75 | Q19: =(SUM(O19:P19)/170)*100 -> 86.470588235294116 | R19: 25 | S19: =R19*3 -> 75 | T19: 75 | U19: =(SUM(S19:T19)/170)*100 -> 88.235294117647058 | V19: 28 | W19: =V19*3 -> 84 | X19: 78 | Y19: =(SUM(W19:X19)/170)*100 -> 95.294117647058812 | Z19: =C19+D19+G19+H19+K19+L19+O19+P19+S19+T19+W19+X19 -> 894 | AA19: =(C19+D19+G19+H19+K19+L19+O19+P19+S19+T19+W19+X19)/1020*100 -> 87.647058823529406 | AB19: B
A20: 7726 | B20: 30 | C20: =B20*3 -> 90 | D20: 75 | E20: =(SUM(C20:D20)/170)*100 -> 97.058823529411768 | F20: 25 | G20: =F20*3 -> 75 | H20: 80 | I20: =(SUM(G20:H20)/170)*100 -> 91.17647058823529 | J20: 26 | K20: =J20*3 -> 78 | L20: 75 | M20: =(SUM(K20:L20)/170)*100 -> 90 | N20: 23 | O20: =N20*3 -> 69 | P20: 80 | Q20: =(SUM(O20:P20)/170)*100 -> 87.647058823529406 | R20: 27 | S20: =R20*3 -> 81 | T20: 78 | U20: =(SUM(S20:T20)/170)*100 -> 93.529411764705884 | V20: 27 | W20: =V20*3 -> 81 | X20: 80 | Y20: =(SUM(W20:X20)/170)*100 -> 94.705882352941174 | Z20: =C20+D20+G20+H20+K20+L20+O20+P20+S20+T20+W20+X20 -> 942 | AA20: =(C20+D20+G20+H20+K20+L20+O20+P20+S20+T20+W20+X20)/1020*100 -> 92.352941176470594 | AB20: A
A21: 8405 | B21: 27 | C21: =B21*3 -> 81 | D21: 80 | E21: =(SUM(C21:D21)/170)*100 -> 94.705882352941174 | F21: 25 | G21: =F21*3 -> 75 | H21: 75 | I21: =(SUM(G21:H21)/170)*100 -> 88.235294117647058 | J21: 26 | K21: =J21*3 -> 78 | L21: 80 | M21: =(SUM(K21:L21)/170)*100 -> 92.941176470588232 | N21: 22 | O21: =N21*3 -> 66 | P21: 70 | Q21: =(SUM(O21:P21)/170)*100 -> 80 | R21: 25 | S21: =R21*3 -> 75 | T21: 80 | U21: =(SUM(S21:T21)/170)*100 -> 91.17647058823529 | V21: 27 | W21: =V21*3 -> 81 | X21: 78 | Y21: =(SUM(W21:X21)/170)*100 -> 93.529411764705884 | Z21: =C21+D21+G21+H21+K21+L21+O21+P21+S21+T21+W21+X21 -> 919 | AA21: =(C21+D21+G21+H21+K21+L21+O21+P21+S21+T21+W21+X21)/1020*100 -> 90.098039215686271 | AB21: A
A22: 8426 | B22: 28 | C22: =B22*3 -> 84 | D22: 80 | E22: =(SUM(C22:D22)/170)*100 -> 96.470588235294116 | F22: 25 | G22: =F22*3 -> 75 | H22: 75 | I22: =(SUM(G22:H22)/170)*100 -> 88.235294117647058 | J22: 27 | K22: =J22*3 -> 81 | L22: 80 | M22: =(SUM(K22:L22)/170)*100 -> 94.705882352941174 | N22: 19 | O22: =N22*3 -> 57 | P22: 65 | Q22: =(SUM(O22:P22)/170)*100 -> 71.764705882352942 | R22: 22 | S22: =R22*3 -> 66 | T22: 80 | U22: =(SUM(S22:T22)/170)*100 -> 85.882352941176464 | V22: 22 | W22: =V22*3 -> 66 | X22: 80 | Y22: =(SUM(W22:X22)/170)*100 -> 85.882352941176464 | Z22: =C22+D22+G22+H22+K22+L22+O22+P22+S22+T22+W22+X22 -> 889 | AA22: =(C22+D22+G22+H22+K22+L22+O22+P22+S22+T22+W22+X22)/1020*100 -> 87.156862745098039 | AB22: B
A23: 8488 | B23: 27 | C23: =B23*3 -> 81 | D23: 75 | E23: =(SUM(C23:D23)/170)*100 -> 91.764705882352942 | F23: 27 | G23: =F23*3 -> 81 | H23: 70 | I23: =(SUM(G23:H23)/170)*100 -> 88.823529411764696 | J23: 25 | K23: =J23*3 -> 75 | L23: 80 | M23: =(SUM(K23:L23)/170)*100 -> 91.17647058823529 | N23: 19 | O23: =N23*3 -> 57 | P23: 75 | Q23: =(SUM(O23:P23)/170)*100 -> 77.64705882352942 | R23: 21 | S23: =R23*3 -> 63 | T23: 75 | U23: =(SUM(S23:T23)/170)*100 -> 81.17647058823529 | V23: 22 | W23: =V23*3 -> 66 | X23: 70 | Y23: =(SUM(W23:X23)/170)*100 -> 80 | Z23: =C23+D23+G23+H23+K23+L23+O23+P23+S23+T23+W23+X23 -> 868 | AA23: =(C23+D23+G23+H23+K23+L23+O23+P23+S23+T23+W23+X23)/1020*100 -> 85.098039215686271 | AB23: B
A24: 8932 | B24: 25 | C24: =B24*3 -> 75 | D24: 80 | E24: =(SUM(C24:D24)/170)*100 -> 91.17647058823529 | F24: 24 | G24: =F24*3 -> 72 | H24: 80 | I24: =(SUM(G24:H24)/170)*100 -> 89.411764705882362 | J24: 27 | K24: =J24*3 -> 81 | L24: 73 | M24: =(SUM(K24:L24)/170)*100 -> 90.588235294117652 | N24: 28 | O24: =N24*3 -> 84 | P24: 80 | Q24: =(SUM(O24:P24)/170)*100 -> 96.470588235294116 | R24: 26 | S24: =R24*3 -> 78 | T24: 80 | U24: =(SUM(S24:T24)/170)*100 -> 92.941176470588232 | V24: 25 | W24: =V24*3 -> 75 | X24: 80 | Y24: =(SUM(W24:X24)/170)*100 -> 91.17647058823529 | Z24: =C24+D24+G24+H24+K24+L24+O24+P24+S24+T24+W24+X24 -> 938 | AA24: =(C24+D24+G24+H24+K24+L24+O24+P24+S24+T24+W24+X24)/1020*100 -> 91.960784313725483 | AB24: A
A25: 9534 | B25: 18 | C25: =B25*3 -> 54 | D25: 75 | E25: =(SUM(C25:D25)/170)*100 -> 75.882352941176464 | F25: 24 | G25: =F25*3 -> 72 | H25: 75 | I25: =(SUM(G25:H25)/170)*100 -> 86.470588235294116 | J25: 24 | K25: =J25*3 -> 72 | L25: 75 | M25: =(SUM(K25:L25)/170)*100 -> 86.470588235294116 | N25: 19 | O25: =N25*3 -> 57 | P25: 75 | Q25: =(SUM(O25:P25)/170)*100 -> 77.64705882352942 | R25: 22 | S25: =R25*3 -> 66 | T25: 80 | U25: =(SUM(S25:T25)/170)*100 -> 85.882352941176464 | V25: 24 | W25: =V25*3 -> 72 | X25: 78 | Y25: =(SUM(W25:X25)/170)*100 -> 88.235294117647058 | Z25: =C25+D25+G25+H25+K25+L25+O25+P25+S25+T25+W25+X25 -> 851 | AA25: =(C25+D25+G25+H25+K25+L25+O25+P25+S25+T25+W25+X25)/1020*100 -> 83.431372549019613 | AB25: B
A26: 9600 | B26: 27 | C26: =B26*3 -> 81 | D26: 80 | E26: =(SUM(C26:D26)/170)*100 -> 94.705882352941174 | F26: 22 | G26: =F26*3 -> 66 | H26: 80 | I26: =(SUM(G26:H26)/170)*100 -> 85.882352941176464 | J26: 28 | K26: =J26*3 -> 84 | L26: 75 | M26: =(SUM(K26:L26)/170)*100 -> 93.529411764705884 | N26: 21 | O26: =N26*3 -> 63 | P26: 75 | Q26: =(SUM(O26:P26)/170)*100 -> 81.17647058823529 | R26: 22 | S26: =R26*3 -> 66 | T26: 80 | U26: =(SUM(S26:T26)/170)*100 -> 85.882352941176464 | V26: 25 | W26: =V26*3 -> 75 | X26: 78 | Y26: =(SUM(W26:X26)/170)*100 -> 90 | Z26: =C26+D26+G26+H26+K26+L26+O26+P26+S26+T26+W26+X26 -> 903 | AA26: =(C26+D26+G26+H26+K26+L26+O26+P26+S26+T26+W26+X26)/1020*100 -> 88.529411764705884 | AB26: A
A27: 9795 | B27: 24 | C27: =B27*3 -> 72 | D27: 75 | E27: =(SUM(C27:D27)/170)*100 -> 86.470588235294116 | F27: 26 | G27: =F27*3 -> 78 | H27: 75 | I27: =(SUM(G27:H27)/170)*100 -> 90 | J27: 27 | K27: =J27*3 -> 81 | L27: 75 | M27: =(SUM(K27:L27)/170)*100 -> 91.764705882352942 | N27: 21 | O27: =N27*3 -> 63 | P27: 75 | Q27: =(SUM(O27:P27)/170)*100 -> 81.17647058823529 | R27: 27 | S27: =R27*3 -> 81 | T27: 80 | U27: =(SUM(S27:T27)/170)*100 -> 94.705882352941174 | V27: 26 | W27: =V27*3 -> 78 | X27: 80 | Y27: =(SUM(W27:X27)/170)*100 -> 92.941176470588232 | Z27: =C27+D27+G27+H27+K27+L27+O27+P27+S27+T27+W27+X27 -> 913 | AA27: =(C27+D27+G27+H27+K27+L27+O27+P27+S27+T27+W27+X27)/1020*100 -> 89.509803921568633 | AB27: A
A28: 9991 | B28: 24 | C28: =B28*3 -> 72 | D28: 75 | E28: =(SUM(C28:D28)/170)*100 -> 86.470588235294116 | F28: 18 | G28: =F28*3 -> 54 | H28: 75 | I28: =(SUM(G28:H28)/170)*100 -> 75.882352941176464 | J28: 26 | K28: =J28*3 -> 78 | L28: 78 | M28: =(SUM(K28:L28)/170)*100 -> 91.764705882352942 | N28: 22 | O28: =N28*3 -> 66 | P28: 75 | Q28: =(SUM(O28:P28)/170)*100 -> 82.941176470588246 | R28: 25 | S28: =R28*3 -> 75 | T28: 78 | U28: =(SUM(S28:T28)/170)*100 -> 90 | V28: 23 | W28: =V28*3 -> 69 | X28: 80 | Y28: =(SUM(W28:X28)/170)*100 -> 87.647058823529406 | Z28: =C28+D28+G28+H28+K28+L28+O28+P28+S28+T28+W28+X28 -> 875 | AA28: =(C28+D28+G28+H28+K28+L28+O28+P28+S28+T28+W28+X28)/1020*100 -> 85.784313725490193 | AB28: B
A29: TOTAL | B29: 30 | C29: =B29*3 -> 90 | D29: 80 | E29: =(SUM(C29:D29)/170)*100 -> 100 | F29: 30 | G29: =F29*3 -> 90 | H29: 80 | I29: =(SUM(G29:H29)/170)*100 -> 100 | J29: 30 | K29: =J29*3 -> 90 | L29: 80 | M29: =(SUM(K29:L29)/170)*100 -> 100 | N29: 30 | O29: =N29*3 -> 90 | P29: 80 | Q29: =(SUM(O29:P29)/170)*100 -> 100 | R29: 30 | S29: =R29*3 -> 90 | T29: 80 | U29: =(SUM(S29:T29)/170)*100 -> 100 | V29: 30 | W29: =V29*3 -> 90 | X29: 80 | Y29: =(SUM(W29:X29)/170)*100 -> 100 | Z29: =C29+D29+G29+H29+K29+L29+O29+P29+S29+T29+W29+X29 -> 1020 | AA29: =(C29+D29+G29+H29+K29+L29+O29+P29+S29+T29+W29+X29)/1020*100 -> 100
A30: MC=Multiple Choice
A31: E=Essay